{
  "source_id": "github-receipt-crawler-v0-20260627",
  "source_type": "receipt_crawler",
  "title": "Receipt crawler production movement proof branch",
  "repository_url": "https://github.com/benleakwerkles/Werkles1.git",
  "branch": "nerdkle/receipt-crawler-v0-20260627",
  "commit": "312e0f811cf8ad46fac1774ee325ff349fcc3012",
  "packet_path": "foreman/source-truth/NEXT_RECEIPT_CRAWLER_PACKET.json",
  "artifact_paths": [
    "scripts/foreman/crawler.js",
    "scripts/foreman/start-receipt-crawler.ps1",
    "scripts/foreman/check-receipt-crawler-preservation.mjs",
    "foreman/source-truth/readbacks/receipt-crawler/RECEIPT_CRAWLER_PRESERVATION_READBACK.json",
    "foreman/source-truth/receipts/receipt-crawler/RECEIPT_CRAWLER_PRESERVATION_RECEIPT.json"
  ],
  "canonicality": "pending_real_inputs",
  "source_status": "PENDING_REAL_LEDGER",
  "evidence_scope": "github_remote_branch",
  "proof_boundary": "Self-test output is not production movement proof until the real circulation.db ledger is read and updated.",
  "observed_at": "2026-06-28T23:00:00-04:00",
  "notes": "Review branch preserves crawler candidate and the required production proof boundary."
}
